,name,business_id,review_count,is_open,stars,city,categories
4152,Brothers Italian Bistro,DZwXQUa5KGUcJ0y4TO1pFQ,53,1,3.0,Las Vegas,"Food, Restaurants, Italian, Pizza"
4153,Del Taco,NqYttaW7CjJjhCN3Q1n-aQ,19,1,2.0,North Las Vegas,"Restaurants, Fast Food, Mexican"
4154,Pure Indian Cuisine,jCNBZnkIFv_0omLVTgNR6Q,259,1,4.5,Las Vegas,"Indian, Restaurants"
4156,Villa Pizza,R073RHVTWuUc_JabjD0bsA,75,1,4.0,Las Vegas,"Pizza, Restaurants"
4158,Churchs Chicken,f5IN-6LowoYpxDeQwb0dow,5,1,2.0,Las Vegas,"Fast Food, Chicken Wings, Restaurants"
4159,Yama Sushi,wdOOK3K6vzQy1d_OIk-U9w,412,1,3.5,Las Vegas,"Sushi Bars, Restaurants"
4160,PTs,glVCZzuFSnf24UGYsOl2Vw,67,1,3.5,Las Vegas,"Bars, Sports Bars, Pubs, Food, American (New), Restaurants, Beer, Wine & Spirits, Nightlife"
4162,Wolfgang Puck Express,BIwjYT9nqbkF7kbzne-tmQ,3,1,2.0,Las Vegas,"Food, Restaurants, American (New)"
4163,Sushi Twister,MXC9pwIxovWUc9yu1F8OxA,396,1,4.0,Las Vegas,"Sushi Bars, Japanese, Restaurants"
4164,IHOP,kJ_Rke1dt9zpbJp9lX6sXw,80,1,2.5,Las Vegas,"Restaurants, American (Traditional)"
4165,Millside,E-pB9yzKnA3kz1cB1zpr6g,31,1,3.0,North Las Vegas,"Sports Bars, American (New), Nightlife, Bars, Restaurants, Pubs, Breakfast & Brunch"
4166,SlickMeals,Pw1v2dO5sZAS5OhqAtYx9w,6,1,4.0,Las Vegas,"Comfort Food, Restaurants"
4167,7 Sinful Subs,aHFkZDm8g27zpzydNE8OMg,57,1,4.5,Las Vegas,"Restaurants, Sandwiches"
4169,Heidis Brooklyn Deli,6uV3KMOo8YQofuNUs4D9pA,86,1,3.5,Las Vegas,"Restaurants, Salad, Breakfast & Brunch, Cajun/Creole, Sandwiches"
4170,Dominos Pizza,iPxDmZVbssspPtUEBnUyQw,20,1,3.0,North Las Vegas,"Restaurants, Sandwiches, Italian, Pizza, Chicken Wings"
4171,Soyo Korean Barstaurant,gTw6PENNGl68ZPUpYWP50A,721,1,4.0,Las Vegas,"Restaurants, Korean, Barbeque"
4172,Papa Johns Pizza,sxXn-KmsJwJZLSGio_m5XA,29,1,2.0,North Las Vegas,"Pizza, Restaurants"
4173,Le Petit Caf\xc3\xa9 & Bakery,Tefx_N6A6nrsdj4jHHnbYg,35,1,5.0,Las Vegas,"Restaurants, Bakeries, Cafes, Themed Cafes, Food, French"
4175,Taco Bell,nvh-zGYHKwIUiPTgwhIScA,17,1,3.0,Las Vegas,"American (New), Restaurants, Mexican, Tex-Mex, Fast Food"
4176,Dominos Pizza,D1TaFES4phv65RmsM8VCiA,19,1,3.0,Las Vegas,"Pizza, Chicken Wings, Restaurants, Sandwiches"
4179,Flemings Prime Steakhouse & Wine Bar,FYqFfaxVRW6pdviONXIoDw,267,1,4.0,Las Vegas,"Bars, Steakhouses, Restaurants, Wine Bars, Nightlife, American (New)"
4180,Bistro 57,wwgRu0TAMX8rfRhsiI0ifQ,81,1,3.5,N Las Vegas,"French, Italian, Modern European, Restaurants, Bistros"
4181,EllaEms Soul Food,D1czdOwjbkIWbXHqphwvXA,265,1,4.0,North Las Vegas,"Soul Food, Southern, Restaurants"
4182,Yummy Grill & Sushi,-wDNRL4lm1UgeFLG9KcrjQ,124,1,3.5,Las Vegas,"Japanese, Hawaiian, Restaurants, Chinese"
4183,Pops Philly Steaks,1SqLPgnZEVeVYDM-AuoFhg,442,1,3.5,Las Vegas,"Restaurants, Cheesesteaks, Sandwiches"
4184,Santa Ana Cafe,gqELGWcpWepjV33yzc4Diw,8,1,2.5,Las Vegas,"Soul Food, Restaurants, Latin American, Mexican, Salvadoran"
4185,Honey Pig,buTa1akbH0pO_P10v99_eA,427,1,3.5,Las Vegas,"Restaurants, Korean"
4187,The Mixx Grill and Lounge,YBE7FO11s32f6BEpTAJ5Rw,197,1,4.5,Las Vegas,"Restaurants, American (Traditional), Nightlife, Arts & Entertainment, American (New), Music Venues, Tapas Bars, Bars, Cocktail Bars"
4188,Rampart Buffet,kwacNh9UDn_sIf0-wBatgA,110,1,2.5,Las Vegas,"Restaurants, Buffets, Steakhouses, Seafood"
4189,PDQ Las Vegas: Sahara,1SCETxRnwaYo2aBC3fi4SA,161,1,4.5,Las Vegas,"Chicken Shop, Sandwiches, Restaurants, Chicken Wings, Salad"
4190,Naked City Pizza On Paradise,HyKxWC9PrqlODjO-CBCIZA,239,1,4.0,Las Vegas,"Italian, Pizza, Restaurants, Chicken Wings"
4192,Monterey Room,mPnuIggOiZA91AUW9FcX9g,4,1,3.0,Las Vegas,"Chinese, Restaurants, American (Traditional)"
4193,Changs Hong Kong Cuisine,OHFH6ALQqq35NiEbD1eXuw,452,1,3.5,Las Vegas,"Seafood, Cantonese, Dim Sum, Diners, Chinese, Restaurants"
4194,El Taco Feliz,CLthP1yn32xlBswIbsLIjQ,82,1,3.5,Las Vegas,"Restaurants, Mexican"
4195,Chilis,XrR41SdmAlPJ__02noDrEQ,41,1,2.0,Las Vegas,"Nightlife, Restaurants, Tex-Mex, Fast Food, Bars"
4196,Kabob Korner,kowv2S_uB6CDMomXFCKhkw,73,1,3.5,Las Vegas,"Pakistani, Mediterranean, Restaurants, Indian"
4197,Rigos Taco,9WVNvQ1UhzXVMihF2Rhuiw,20,1,3.5,Las Vegas,"Restaurants, Fast Food, Mexican"
4198,Wake Up Coffee Cafe,7usumJrTK_qs2GbSd8zIvg,78,1,4.0,Las Vegas,"Restaurants, Cafes, Hot Dogs, Breakfast & Brunch, Food, Coffee & Tea"
4200,Jo\xc3\xabl  Robuchon,XnJeadLrlj9AZB8qSdIR2Q,777,1,4.5,Las Vegas,"French, Restaurants"
4201,Sbarro,aoXb8mDCyb-XbkITiIfYVA,33,1,2.5,Las Vegas,"Salad, Restaurants, Italian, Pizza"
4203,Coco Cafe,Pg7DrmU-OjuRGLVR7jVHRg,3,1,5.0,Las Vegas,"Sandwiches, Restaurants, Desserts, Coffee & Tea, Food, Breakfast & Brunch"
4204,Asadas Tacos,zrMpy_uQ5_77YapMkp8lUA,21,1,3.0,Las Vegas,"Restaurants, Mexican"
4205,Loco Cantina,NOfbzTpQ7hrt6ZbJVeXUUw,190,1,3.5,Las Vegas,"Restaurants, Mexican"
4206,Teriyaki Madness,YI08egmS9lWWB6N6MmrePw,148,1,4.0,Las Vegas,"Salad, Hawaiian, Restaurants, Asian Fusion, Japanese"
4207,La Sirena,2QbWs3zL31_pRN2xo3obwA,3,1,3.0,Las Vegas,"Mexican, Restaurants"
4208,Rivas Mexican Grill #2,wjf1uZNr6E4LQ0nUNHX5AA,31,1,4.0,Las Vegas,"Mexican, Restaurants"
4209,Magal BBQ,aS1qJzTGyluRT2tJ09Jbaw,370,1,4.5,Las Vegas,"Barbeque, Korean, Restaurants"
4211,La Palma Market,iQOjQH30LFsj6aO3wJG7nQ,4,1,4.0,Las Vegas,"Mexican, Restaurants"
4212,Papa Murphys,kQabQnNavQ7FgfyuXf8Niw,23,1,3.5,Las Vegas,"Pizza, Restaurants"
4213,Cracker Barrel Old Country Store,wtxKAHReCUOnPY08KMQcrQ,354,1,3.0,Las Vegas,"Food, Juice Bars & Smoothies, American (Traditional), Restaurants, Southern, Breakfast & Brunch, Sandwiches"
4214,Gandhi Indias Cuisine,S1Gpj_cqlEzitBCGAXj5aA,288,1,3.5,Las Vegas,"Pakistani, Vegan, Restaurants, Vegetarian, Indian"
4215,Laos Asia Market,qQXc9D6PV1Y8RhIBZpj-Jg,41,1,4.5,Las Vegas,"Food, Laotian, International Grocery, Ethnic Grocery, Grocery, Restaurants"
4217,Taqueria El Tizon Grill,UVqelOc_xJwy6lfnOhiCLQ,13,1,4.0,Las Vegas,"Restaurants, Mexican"
4218,Sofias Cafe,OMUe6NNOFEe0VdAouIqAuA,34,1,3.5,Las Vegas,"Restaurants, Italian, Soup, Pizza, Mediterranean"
4219,McDonalds,Uw4z3M7H4buYtTGBrzFCSg,13,1,1.5,Las Vegas,"Fast Food, Restaurants"
4220,Mos Race Day Cafe,IYydfjUO5kb-N4KwSPlEcA,36,1,4.0,Las Vegas,"Coffee & Tea, Food, Restaurants, Cafes, American (Traditional)"
4222,Triple 7 Restaurant & Microbrewery,YZGSNhgTS6YeyUYoivD-Ww,432,1,3.5,Las Vegas,"American (Traditional), Sushi Bars, Restaurants, Bars, Pubs, Nightlife, Breweries, Food"
4223,Jollibee,uu5AtMrz_94e8kk4Gixg9Q,148,1,3.5,Las Vegas,"Filipino, Fast Food, Restaurants"
4225,Dragon Grille,tv-WIUQifcp5J9pUKoiE3Q,52,1,4.5,Las Vegas,"Restaurants, Food, Food Trucks, Asian Fusion"
4226,California Pizza Kitchen,XVVFgEY-0MsyEAR8SO7dzg,138,1,2.5,Las Vegas,"Restaurants, Salad, Soup, Pizza"
4227,Burke in the Box,DXYhrg9EXuW8n5QMnCoHAg,144,1,2.0,Las Vegas,"American (Traditional), Restaurants"
4229,Hamadas Asiana,Ziqzfvpp2cpZAu0OwjiD5w,3,1,1.5,Las Vegas,"Restaurants, Japanese"
4232,Flock & Fowl,68jn0s0snbO5dhasLaVvDw,263,1,4.5,Las Vegas,"Chicken Shop, Restaurants, Singaporean, Chinese"
4233,Viet Noodle Bar,ygaOvp0PLBYaYeN9cZAlGg,470,1,4.5,Las Vegas,"Restaurants, Barbeque, Vietnamese, Soup"
4237,Raising Canes,3vxIqhm2jCVjkUWtmDvTsw,421,1,4.0,Las Vegas,"Restaurants, Fast Food, Chicken Shop, American (Traditional), Chicken Wings"
4238,Capriottis,plwa-yW-uQaJ7fiIAotOWg,61,1,4.0,Las Vegas,"Restaurants, Sandwiches, Delis"
4239,Jack In the Box,EU8Hp2rTEptiwCH4eLYZBw,9,1,2.0,Las Vegas,"Burgers, Restaurants"
4241,17 South Booze & Bites,dNRbhJt4wd-ZU4lFVK3iiw,57,1,3.0,Las Vegas,"American (New), Restaurants"
4242,Taqueria El Tizon Grill 2,jWHr_b19C1SjRvfI9jbdmQ,48,1,4.0,Las Vegas,"Restaurants, Mexican"
4243,Rebel Republic,bPh7M1vos_V-g8_s-eHaNA,188,1,4.0,Las Vegas,"Burgers, American (New), Sports Bars, Nightlife, Pubs, Restaurants, Bars"
4244,Grimaldis Pizzeria,RRw9I8pHt5PzgYGT2QeODw,395,1,4.0,Las Vegas,"Restaurants, Pizza"
4245,Sourdough Cafe,PYUyY5E1MPn_8m9WZeMDHA,72,1,3.5,Las Vegas,"Diners, American (Traditional), Restaurants"
4246,The Hush Puppy,hm5Tgbj-IWQqe-ImqnBaNg,42,1,3.5,Las Vegas,"Restaurants, Southern, Comfort Food, Seafood"
4247,El Buen Gusto,_cBlppMDZYXS-Bjj4l9qtw,5,1,2.5,Las Vegas,"Restaurants, Salvadoran, Latin American"
4248,American Subs,rFs8owHtutwwlqpU9pPIsQ,11,1,3.0,Las Vegas,"Restaurants, Sandwiches"
4249,Millers Ale House - Las Vegas,VGWEpMEkzQopS5lUNd06Sw,462,1,3.5,Las Vegas,"American (New), American (Traditional), Nightlife, Seafood, Bars, Sports Bars, Restaurants"
4250,China Wok,Rtl6MbWZABlf5sU-Ni72xQ,32,1,3.0,North Las Vegas,"Restaurants, Chinese"
4251,Villa Fresh Italian Kitchen,MD2lokfrZ-2NlDMkKbgEPA,20,1,2.5,Las Vegas,"Pizza, Restaurants"
4252,The Kitchen,SSbfgPK3Wa24svQty7QWSg,15,1,4.5,Las Vegas,"Caterers, Restaurants, Sandwiches, Event Planning & Services, Pizza, Chicken Wings"
4253,Dominos Pizza,rd8NXOBTsASiXriuooki_A,33,1,2.5,Las Vegas,"Restaurants, Pizza, Chicken Wings, Sandwiches"
4254,Hummus Vegas,ZEvEAMlc0YA0fFkwY96WJQ,7,1,3.5,Las Vegas,"Kosher, Restaurants, Salad, Middle Eastern"
4255,Five Guys Burgers and Fries,IU55VgrpLzVKo9sXWbTn3Q,104,1,3.5,North Las Vegas,"American (New), Fast Food, Burgers, Restaurants"
4256,The Great American Bagel,ykfsYdN3QF8HEBa9EbJRBg,55,1,2.5,Las Vegas,"Sandwiches, Bagels, Coffee & Tea, Food, Restaurants"
4257,Hamburger Hut N Market,2JU7FRlnYgdRauYyFzHSLA,103,1,4.0,North Las Vegas,"Restaurants, Burgers, Chicken Wings"
4258,McDonalds,agySn0Jacnul-OiiNV8Rrg,20,1,2.0,North Las Vegas,"Fast Food, Restaurants, Burgers"
4260,Carls Jr.,CiAZtA0C8AYcPdaaKt816A,18,1,4.0,Las Vegas,"Fast Food, Restaurants"
4262,Foodie Fit,k0iSRXXqw49yugl8UUpbsw,18,1,5.0,Las Vegas,"Event Planning & Services, Restaurants, Personal Chefs, Food Delivery Services, Food, American (Traditional)"
4264,M&M Soul Food Cafe,NLEe-RzDSU-5BN6xp_WWCw,561,1,4.0,Las Vegas,"American (Traditional), Restaurants, Soul Food, Southern"
4265,El Pollo Mobile,5tl4tyaJEzGeAdbi_L7PzQ,30,1,4.0,Las Vegas,"Mexican, Restaurants, Food Stands"
4267,Jack in the Box,ttsLdrsKe24vXZcmZXcZ4g,8,1,3.0,N Las Vegas,"Burgers, Restaurants"
4268,Yi Mei Champion Taiwan Deli,JjjlhlQ2LEaQMuAug4fDIA,209,1,3.5,Las Vegas,"Restaurants, Chinese, Taiwanese"
4269,Globe Cafe,_R76PYZqTRvw840SP6s5GA,41,1,4.0,Las Vegas,"Restaurants, American (New), Food, Coffee & Tea, Cafes"
4270,Zaytoon Mediterranean Market and Kabo,saQQmDQQJ14BVkm_sg53UA,283,1,4.5,Las Vegas,"Food, Middle Eastern, Grocery, Mediterranean, Halal, Kosher, Persian/Iranian, Restaurants"
4271,The Phoenix Kitchen,C45YKxSDpBekWLPDl_-xBA,5,1,5.0,Las Vegas,"Lounges, American (Traditional), Nightlife, Tapas/Small Plates, American (New), Bars, Gay Bars, Restaurants, Gastropubs"
4273,Putters Bar & Grill,7hXWFtmoJHz63SD8k56a_Q,30,1,3.0,Las Vegas,"Bars, Nightlife, American (Traditional), Restaurants"
4274,China Joes,haa0u6VwTWBXbIW0mxlSGw,47,1,2.5,Las Vegas,"Restaurants, Chinese"
4275,Sonic Drive-In,oIcGZlqwrKkyw_L6YAVYfw,12,1,3.0,Las Vegas,"Ice Cream & Frozen Yogurt, Fast Food, Restaurants, Food"
4276,Manhattan Pizza,ai8nfTBNvL579cjIuqZajQ,119,1,3.5,Las Vegas,"Restaurants, Pizza"
4278,Taco Bell,JWN22sQ7cl9KjmIk0nMbUg,14,1,2.5,Las Vegas,"Restaurants, Tex-Mex, Mexican, Fast Food"
4281,Carls Jr Restaurants,jNGIUPDbFDOUDk3yw9gEuw,7,1,2.5,North Las Vegas,"Burgers, Fast Food, Restaurants"
4282,Napoli Pizzeria,xB7bsOpJbnK9nHEZw1ARDg,317,1,3.0,Las Vegas,"Restaurants, Sandwiches, Chicken Wings, Pizza"
4285,Carnegie,zU9w_xRlQSRIYXxGo-HSOA,808,1,3.0,Las Vegas,"Sandwiches, American (New), Delis, Restaurants, American (Traditional)"
4286,Big Dogs Brewing,ozEDKl0tZw5ob1evx41gcQ,323,1,3.5,Las Vegas,"Breweries, American (Traditional), Food, Restaurants"
4289,China Hot Wok,8FUzCm4Q13MJMX7N6ftmQw,140,1,4.0,Las Vegas,"Food, Ethnic Food, Chinese, Specialty Food, Restaurants"
4290,Applebees,8bYXg27QEoAx7us15eIL5g,66,1,2.5,Las Vegas,"Nightlife, Restaurants, Bars, Sports Bars, Burgers, American (Traditional), Fast Food"
4291,Baja Bar & Grill,jG0m1-899xwYY3IXpTRRCQ,146,1,4.5,Las Vegas,"Restaurants, Mexican"
4292,P.F. Changs,Ch3HkwQYv1YKw_FO06vBWA,195,1,3.5,Las Vegas,"Restaurants, Chinese, Gluten-Free, Asian Fusion"
4293,Pho Bosa,NQhPS0MUKJgBUB6PTLlmzA,501,1,4.0,Las Vegas,"Restaurants, Vietnamese, Soup"
4295,Karma Ultra Lounge,SpGlMSBHPURVqJW7m4bdrA,3,1,2.5,Las Vegas,"Lounges, Food, American (Traditional), Bars, Nightlife, Restaurants, Breakfast & Brunch, Coffee & Tea, Hookah Bars"
4296,Goldfingers Bar & Grill,iuiwjTcIJjt2kYSpBlH_lg,31,1,3.5,Las Vegas,"American (Traditional), Restaurants"
4297,Freeds Bakery,olmCDBoMF-EhN8U2livBSg,612,1,4.0,Las Vegas,"Restaurants, Desserts, American (New), Bakeries, Cupcakes, Food, Breakfast & Brunch"
4298,PTs Ranch,Xy8R4AnLP3LxwFIYoPfhJg,30,1,3.5,Las Vegas,"Bars, Nightlife, Restaurants, Pubs, American (New), Sports Bars"
4299,Jack In the Box,3Gw8YcAjo3AcMbtbX1TGSA,14,1,3.0,Las Vegas,"Fast Food, Restaurants"
4300,Hedarys Mediterranean Restaurant,Ssa6XY_RdDRRB9wuVIeIWw,178,1,4.0,Las Vegas,"Middle Eastern, Mediterranean, Lebanese, Greek, Restaurants"
4301,Joyful House Chinese Cuisine,jfmyj519pg2flxGEQ2xdPg,393,1,3.5,Las Vegas,"Seafood, Restaurants, Chinese, Cantonese"
4304,Robertos Taco Shop,xq0RhDKNNUg8t3JJUqX3fw,17,1,3.0,Las Vegas,"Mexican, Fast Food, Restaurants"
4305,McDonalds,Lv7T_OIAX112_Xio5cPbhQ,4,1,3.0,North Las Vegas,"Burgers, Restaurants, Fast Food"
4306,KFC,aSn4fgpq-3FDfvVG2bjv3A,15,1,2.0,Las Vegas,"Burgers, Fast Food, Chicken Wings, Restaurants"
4307,Fatburger,pCVQq3jzfrT2CNHAIMMy0g,38,1,2.5,Las Vegas,"Restaurants, Burgers, Fast Food, American (Traditional)"
4308,Wendys,LOyGm5Q6zdTHdntLBUyBrg,24,1,2.0,Las Vegas,"Fast Food, Restaurants, Burgers"
4309,China a Go Go,r6WO_jkx4rkMMauvPvMDeQ,80,1,3.5,North Las Vegas,"Restaurants, Chinese"
4311,Smashburger,-Bv-HHUs8aHzDrdWcZHn8w,43,1,3.0,Las Vegas,"Restaurants, Burgers"
4313,Golden China,ZGpT6rcgSsJ4GxwTHbvvJw,51,1,3.5,Las Vegas,"Restaurants, Chinese"
4314,Dominos Pizza,dPqbKki9KBSFjxxLj_urwA,23,1,3.0,North Las Vegas,"Chicken Wings, Sandwiches, Pizza, Restaurants"
4315,Violas Tavern,ByTWVwFUq5gJ17FhZfZeyQ,6,1,2.5,Las Vegas,"Casinos, Restaurants, Burgers, Pizza, Sports Bars, Nightlife, Arts & Entertainment, Bars"
4317,Wingstop,HD4JDFoc_htq5VYESJT8gw,95,1,3.5,Las Vegas,"Chicken Wings, American (Traditional), Restaurants, Fast Food"
4318,Panda Express,K0FtmxCgqJEbDNCyXyMX_w,13,1,3.5,Las Vegas,"Restaurants, Fast Food, Chinese"
4319,Chiamaka Food,-Jo0rJr2mZxBVgaJqDs-TQ,3,1,4.0,Las Vegas,"Restaurants, South African, African"
4320,#1 Hawaiian Barbecue,42yLya7lhe7TQGz3KEdKAw,23,1,3.5,Las Vegas,"Hawaiian, Barbeque, Seafood, Restaurants"
4321,Jackie Bee Boba Express,N6BDiFk2CyJTMPGUlcOfAg,111,1,4.0,Las Vegas,"Food, Cafes, Restaurants, Bubble Tea, Coffee & Tea, Fast Food"
4323,Dairy Queen,qZQI5SSqreUqVHl8i8JwOA,18,1,2.5,Las Vegas,"Ice Cream & Frozen Yogurt, Fast Food, Food, Restaurants"
4324,Egg & I,3kdSl5mo9dWC4clrQjEDGg,2303,1,4.5,Las Vegas,"Restaurants, Sandwiches, Burgers, American (Traditional), Breakfast & Brunch"
4325,Samurai Sams,dYpnpMZowfGsCisHhABPZg,60,1,3.0,Las Vegas,"Japanese, Restaurants"
4326,IHOP,H-05-lRUJDUNDgYgaw7bXA,85,1,2.5,Las Vegas,"American (New), Breakfast & Brunch, Diners, Restaurants, American (Traditional)"
4327,Brandos Sportsbar,vFTKENEf3AxbodEshK5W2A,83,1,4.0,Las Vegas,"Restaurants, Sports Bars, Nightlife, Chicken Wings, Bars, Pizza"
4328,Subway,Ad_-9GuDFTEjAsSQ3PXLOw,7,1,3.5,Las Vegas,"Restaurants, Sandwiches, Fast Food"
4329,Carls Jr Restaurants,xpCBsOqICPNtcR07qOL0bw,12,1,3.0,Las Vegas,"Fast Food, Restaurants, Burgers"
4330,Juans Flaming Fajitas & Cantina,SVGApDPNdpFlEjwRQThCxA,884,1,4.5,Las Vegas,"Restaurants, Mexican, Bars, Nightlife"
4331,Pizza Hut,uIbZjRRqR1OR-t2NBCa1Wg,25,1,2.5,Las Vegas,"Italian, Pizza, Restaurants"
4332,Loves,8I2Xb-mksGen0ra2CnUJpw,16,1,4.0,Las Vegas,"Food, Auto Repair, American (New), Restaurants, Automotive, Convenience Stores, Gas & Service Stations, Truck Rental"
4333,Bowlology,ut3r-meTqKfkEZBzkdBE6w,28,1,4.0,Las Vegas,"Gluten-Free, Juice Bars & Smoothies, Food, Vegan, Restaurants"
4334,Chipotle Mexican Grill,-FNquqGseSCVMWo7KbK-Tg,97,1,3.5,Las Vegas,"Restaurants, Mexican, Fast Food"
4335,Cafe Rio,WLblFINiPI18_o1OdDsnVg,168,1,3.0,Las Vegas,"Mexican, Restaurants"
4336,Playas De Cancun,lmNpuLiA6Jtn3lL2Ec43Qw,7,1,4.5,Las Vegas,"Mexican, Burgers, Restaurants"
4337,Saffron Flavors of India,t4bBKVXbr8bIN9nEJIobYg,238,1,4.0,Las Vegas,"Indian, Vegetarian, Diners, Restaurants"
4339,Timbers - Cheyenne,d4bMBIhBELF_bhkT-Sig3Q,38,1,3.5,Las Vegas,"Nightlife, Bars, Restaurants, American (Traditional), Breakfast & Brunch"
4341,Pieology Pizzeria,fP4sMlVw_MvyGNv4xeTGDA,143,1,4.5,Las Vegas,"Pizza, Restaurants"
4342,Wendys,MR-oGBw4MLDoqAwS6TaYZw,16,1,2.5,Las Vegas,"Restaurants, Hot Dogs, Fast Food, Burgers"
4343,Pho Saigon 8,M30I1NPl5JuHthxo1IXPGg,408,1,3.5,Las Vegas,"Restaurants, Vietnamese"
4345,Osaka Japanese Bistro Summerlin,czx3G3V_f-4ZDg9YKJ0YQA,325,1,2.5,Las Vegas,"Restaurants, Sushi Bars, Japanese"
4346,Dennys,klsBtNP-vlO3QlfPbAtTzQ,42,1,3.0,Las Vegas,"Restaurants, Diners, Burgers, American (Traditional), Breakfast & Brunch"
4347,Burger King,vLpm63d_fxnbtiZTlbrQDA,36,1,2.0,Las Vegas,"Food, Restaurants, Burgers, Fast Food"
4348,Geisha House Steak & Sushi,2pV-BNJvTL3f3EiMZlv6_w,208,1,3.5,North Las Vegas,"Steakhouses, Japanese, Restaurants, Sushi Bars"
4349,Carls Jr.,OxpdfbfDgd4xpZqc9IRlJw,6,1,3.5,North Las Vegas,"Restaurants, Fast Food, Burgers"
4350,Icy Juicy,YU2XR_ZY-g2VzDpi7KMzEw,216,1,3.5,Las Vegas,"Coffee & Tea, Bubble Tea, Taiwanese, Food, Restaurants"
4351,Dairy Queen / Orange Julius Treat Center,RvXOCaZokr_sfoLQpm1JRQ,8,1,3.0,Las Vegas,"Restaurants, Food Stands"
4352,Carrabbas Italian Grill,PSRZaGGxXmOmabL2si8pKw,189,1,3.5,Las Vegas,"Seafood, Restaurants, Italian"
4353,Roys Restaurant,1Df5WnLX3DqN6ymlhqznaQ,431,1,4.5,Las Vegas,"Seafood, Hawaiian, Restaurants, Steakhouses, Asian Fusion"
4354,Hungry Howies #907,OIrYGca3yQdxEZQR2yhj3w,55,1,3.0,Las Vegas,"Pizza, Restaurants"
4356,Subway,g1Lm3Foiv287usRBXXzabw,8,1,1.5,Las Vegas,"Restaurants, Fast Food, Sandwiches"
4357,Capriottis Sandwich Shop,7UtqNjjd9D6oU7UcT2nxig,67,1,3.5,Las Vegas,"Restaurants, Sandwiches"
4358,ChiAm Restaurant,CztQkxRXch0__MsSmB0tTw,47,1,3.5,Las Vegas,"Fast Food, Chinese, Restaurants, Dim Sum"
4359,Southern Kitchen,6LkNSA3b3dufG5_dKfEQdQ,5,1,5.0,Las Vegas,"Event Planning & Services, Food Trucks, Food, Restaurants, Sandwiches, Caterers, Southern"
4361,Tonkatsu Kiyoshi,eR7Iw_X54m3YLWkXp9y35Q,393,1,4.5,Las Vegas,"Hawaiian, Restaurants, Japanese, Specialty Food, Food, Ethnic Food"
4364,Macayo Vegas,9ehTNgvu0vZgHjWkQqF6KQ,48,1,3.5,Las Vegas,"Mexican, Restaurants"
4365,Salted Malted Bakery & Creamery,KVqWA98XZwGhJ3YbFNi0vw,298,1,4.5,North Las Vegas,"Ice Cream & Frozen Yogurt, Cafes, Restaurants, Donuts, Breakfast & Brunch, Poutineries, Sandwiches, Coffee & Tea, Bakeries, Food"
4366,Golden Steer Steakhouse,hRQS8y-uG2kc8miWVYiLuQ,555,1,4.0,Las Vegas,"Steakhouses, Restaurants"
4368,Jerusalem Grill & Bar,SFaCcwpIKjrpnT1IjzEDdg,170,1,4.0,Las Vegas,"Tapas Bars, Kosher, Mediterranean, Restaurants"
4369,Jack in the Box,bFUWmRKsCkborKVe6oaA5g,16,1,3.0,Las Vegas,"Fast Food, Restaurants, Burgers"
4370,WingNutz,w_Cw1-80276SAhHw2LJqFQ,99,1,3.5,Las Vegas,"Food, Sports Bars, Burgers, Pubs, Chicken Wings, Grocery, Bars, Restaurants, Nightlife"
4371,Dairy Queen,oDQG-l5jts3-M2r9xKquyA,34,1,2.0,Las Vegas,"Restaurants, Food, Fast Food, Ice Cream & Frozen Yogurt"
4372,Kabuki Japanese Restaurant,O7ot_LMlCfLpOP9tBqeNfw,461,1,3.5,Las Vegas,"Asian Fusion, Japanese, Restaurants, Sushi Bars"
4374,Mc Donalds,7Ppgpgva-HP3o3h-xp2sWw,5,1,2.0,Las Vegas,"Burgers, Restaurants, Fast Food, American (Traditional)"
4376,Subway,AurgTYGyCItvvgFp9NQBag,7,1,2.5,Las Vegas,"Restaurants, Sandwiches, Fast Food"
4377,Arata Sushi & Bowl,DA-ddRqcReCe_DcXKicvsQ,50,1,4.5,Las Vegas,"Japanese, Restaurants, Sushi Bars"
4379,Pressed For Juice,2hSIeCX2cV-chFcBBXrZZA,128,1,4.5,Las Vegas,"Juice Bars & Smoothies, Food, Coffee & Tea, Restaurants, Organic Stores, Gluten-Free"
4380,Michaels Gourmet Room,296PZdxSrtH08EUwCsOKMw,115,1,4.5,Las Vegas,"American (Traditional), Seafood, Steakhouses, Restaurants"
4381,Del Mar Deli,sUMi2q41l4AzOsmJMRY8zQ,96,1,3.5,Las Vegas,"Restaurants, Breakfast & Brunch, Delis, Sandwiches"
4384,MB China,EQDJVVIgenbyNZpRcqUWcw,37,1,4.0,North Las Vegas,"Chinese, Restaurants"
4385,Newport Cafe,XAOOeEtTOlyRKdeX8cmAsQ,11,1,4.0,Las Vegas,"Sandwiches, Salad, Pizza, Cafes, Restaurants"
4387,Taco Bell,eNMNXsMjT_PJ5sslcmoYQQ,18,1,2.0,North Las Vegas,"Fast Food, Restaurants, Tex-Mex, Mexican"
4388,Tamba,Mn6PbumS7GL2v3jPilTaeg,457,1,3.5,Las Vegas,"Halal, Gluten-Free, Indian, Restaurants, Pakistani, Nightlife, Bars"
4389,JBs Smokehouse Jerky,VCzxfiTZP66V71j4r1ZKxA,20,1,5.0,Las Vegas,"Restaurants, Food, Food Trucks, Barbeque, Smokehouse, Meat Shops, Specialty Food"
4390,Crazy Pita Rotisserie & Grill,F6p_k-Q6W_kkAb-s_a0Omw,129,1,4.0,Las Vegas,"Restaurants, Mediterranean"
4392,Raising Canes,hQ8JN52MjxbMUPfuhyL7jQ,68,1,3.5,North Las Vegas,"Restaurants, Chicken Shop, Chicken Wings, American (Traditional), Fast Food"
4394,Pizza Hut,9K1A2EqSq5dw51K7kEljpw,34,1,2.0,North Las Vegas,"Fast Food, Pizza, Restaurants"
4395,Chow King,nTc-Qj_-ABZrpM9YSpJ6jA,93,1,3.0,Las Vegas,"Restaurants, Filipino, Cantonese, Asian Fusion, Chinese, Fast Food"
4397,Popeyes,mAIPUQPJiWXudRbOaBX33g,70,1,1.5,Las Vegas,"Restaurants, Fast Food, Chicken Wings"
4400,Cabo Wabo Cantina,tthhJbshogN6gxy3fMp58g,4,1,3.5,Las Vegas,"Burgers, Restaurants"
4401,Jack in the Box,TDTASGFy_aGp6vy0i23mDA,22,1,3.0,Las Vegas,"Restaurants, Fast Food"
4402,Burger King,nteAMOsI2DsTTR9v6G9E7A,11,1,2.0,Las Vegas,"Restaurants, Fast Food"
4403,Wingstop,SQHhAQi-sGqKRMFDlTbR5w,26,1,4.0,Las Vegas,"Restaurants, Chicken Wings"
4406,Subway,qBiLs12q5GO_PNp01vACoQ,4,1,3.0,North Las Vegas,"Fast Food, Sandwiches, Restaurants"
4410,Corner Thai Kitchen,qKn9nynsVYIST8rf6tEFRQ,138,1,4.0,Las Vegas,"Restaurants, Thai"
4412,Capriottis Sandwich Shop,Yqg9Muttvbm9s2r-HZY18Q,35,1,4.0,North Las Vegas,"Sandwiches, Salad, Restaurants, Vegetarian"
4413,Makers & Finders Coffee,CoyeXg8FBsS_d20QzNIy-A,466,1,4.5,Las Vegas,"Breakfast & Brunch, Coffee & Tea, Latin American, Cafes, Restaurants, Food"
4414,Sushi-ko,EZ4TljJvGenxrkM4JsqtZg,223,1,3.5,Las Vegas,"Japanese, Teppanyaki, Restaurants, Sushi Bars"
4416,Sakana,7sb2FYLS2sejZKxRYF9mtg,1443,1,4.5,Las Vegas,"Sushi Bars, Japanese, Restaurants"
4418,Cheeburger Cheeburger,fxuUGJ6si0QxcRKn_KNkEA,80,1,3.5,Las Vegas,"Restaurants, Burgers"
4420,Jasons Deli,-_yEVC3_3M6YOsamYfNFEw,147,1,4.0,Las Vegas,"Sandwiches, Delis, Restaurants, American (New)"
4421,Port of Subs,94mQ3aJ2xjP6W-CV1j8cXg,10,1,3.0,Las Vegas,"Restaurants, Sandwiches, Delis"
4422,Winchells Pub & Grill,I6pcm_XcmXXfAfNdPffZlA,39,1,4.0,North Las Vegas,"Pubs, Nightlife, Bars, American (Traditional), Restaurants"
4423,Subway,rReN_exlBKL3XqYnck3ndA,13,1,3.0,Las Vegas,"Sandwiches, Restaurants, Fast Food"
4424,Burger King,PWWuvwKa3sUnBIjTar4dEw,6,1,2.0,Las Vegas,"Restaurants, Burgers, Fast Food"
4425,Home Team Sports,HpKcIWjcq3osQ13pBF0RXw,36,1,2.0,Las Vegas,"Nightlife, Bars, Sports Bars, Restaurants, Sandwiches"
4426,Olocuilta Restaurant,OioKDmq7U1WFMqaPWGUR3A,13,1,3.0,Las Vegas,"Mexican, Restaurants"
4428,Sakura Japanese Cuisine,7gdpCYPKkQqfiWDoTQnHgQ,19,1,4.5,Las Vegas,"Food, Restaurants, Japanese"
4429,TENDER Steak & Seafood,16Fplxu-OwVmTEFxQAUP4g,364,1,3.5,Las Vegas,"Restaurants, Steakhouses, Bars, American (Traditional), Nightlife"
4430,Blue Martini Lounge,UCpUOtvqR-NBWBNVMzJleA,681,1,3.5,Las Vegas,"Restaurants, American (New), Lounges, Nightlife, Bars"
4431,Du-pars,Y-j6rMW97usezKAs9Usuew,97,1,2.5,West Las Vegas,"Breakfast & Brunch, American (Traditional), Casinos, Food, Arts & Entertainment, Restaurants, Bakeries"
4432,Goto Queen,kIYJfoODzS2PA9VzFxo8DQ,26,1,4.5,Las Vegas,"Soup, Filipino, Restaurants, Asian Fusion"
4434,Juice N Go,XBEx2FI2GKmsjs7eWNr7Lw,228,1,4.5,Las Vegas,"Restaurants, Brazilian, Food, Juice Bars & Smoothies, Ice Cream & Frozen Yogurt"
4435,Tacos Mexico,HUKbH7r9TBJPri6LJbBKtw,101,1,3.0,Las Vegas,"Mexican, Restaurants"
4436,Linos Pizzeria & Italian Cuisine,OYaL_-uxBCgrE94uNQ4VCA,64,1,4.0,Las Vegas,"Food, Restaurants, Pizza, Desserts, Salad"
4437,Las Vegas Chinatown Plaza,8KsMtzkmKgNsiVWyeeYQYw,47,1,3.5,Las Vegas,"Chinese, Shopping, Shopping Centers, Restaurants"
4438,D Pinoy Joint,xqbvqZHNyj2qExHdizzd0w,148,1,3.5,Las Vegas,"Filipino, Restaurants"
4440,Victorys Bar & Grill,YqhhwTqRdLsf7V4yKA33-A,79,1,3.0,North Las Vegas,"Restaurants, American (Traditional), Cafes"
4441,Kinh Do,-IWsoxH7mLJTTpU5MmWY4w,678,1,4.0,Las Vegas,"Restaurants, Noodles, Vietnamese"
4442,KFC,t7yA67hvHrwU_lwVBfRB9g,4,1,2.0,North Las Vegas,"Fast Food, Restaurants, Chicken Wings"
4444,Umiya Sushi,q-zZgXKAQFLEgMp9ZNllgQ,1033,1,4.0,Las Vegas,"Seafood, Japanese, Restaurants, Sushi Bars"
4446,Verona Pizza,45513UgSlMqWV_yAPVkXrg,65,1,3.5,Las Vegas,"Pizza, Restaurants, Italian"
4448,GameWorks,n7V4cD-KqqE3OXk0irJTyA,264,1,3.0,Las Vegas,"American (New), Arts & Entertainment, Arcades, Restaurants, Gastropubs"
4450,Popeyes Louisiana Kitchen,f-4N8MXGy_ifyGtfZrh6SQ,43,1,3.5,Las Vegas,"Restaurants, Chicken Wings, Fast Food"
4453,Home Turf,RMEYQsiGJaol3sxufqwnnw,16,1,1.5,Las Vegas,"Airports, Sports Bars, American (Traditional), Nightlife, Bars, Hotels & Travel, Restaurants, Shopping Centers, Shopping"
4454,Prickly Pear Cafe,YCfGBnOZl8mGi7m7oWf4rg,5,1,2.0,Las Vegas,"Restaurants, Sandwiches"
4455,Krazy Buffet,hDL3Q-GNQlOuE04_zWEMJA,273,1,3.5,Las Vegas,"Buffets, Chinese, Restaurants, Asian Fusion"
4457,Hot Tofu,W-bfM3k64ZwUeBeKnpeSpA,13,1,3.0,Las Vegas,"Food Court, Korean, Restaurants"
4458,Baja Fresh,h_-KUSA612pFEIGC_dCsKQ,41,1,3.0,Las Vegas,"Restaurants, Mexican"
4459,Robertos Taco Shop,eqRYda9F_4ziinRW-N6ixw,31,1,2.5,Las Vegas,"Restaurants, Fast Food, Mexican"
4463,Curbside Cafe,5tzNOeow197qn-a0tUJdVA,54,1,4.0,Las Vegas,"Sandwiches, Burgers, Caterers, Restaurants, Food Stands, Event Planning & Services, Food Trucks, Food"
4464,Quiznos,hJX8WoV-KbFVHojZ6i83Cg,13,1,3.5,Las Vegas,"Delis, Fast Food, Sandwiches, Restaurants"
