,name,business_id,review_count,is_open,stars,city,categories
2612,Burger King,r5Ps1Ir6xzJRMLmCWiBXdg,18,1,2.5,Las Vegas,"Fast Food, Restaurants"
2613,Johnny Rockets,dJS3iH-odljqWS9MKEFsBA,84,1,3.0,Las Vegas,"Burgers, Diners, Restaurants, Sandwiches, American (Traditional)"
2614,The Henry,Er8DpPwf_lHHv64ncWhD8g,624,1,3.5,Las Vegas,"American (Traditional), Breakfast & Brunch, Restaurants"
2615,McDonalds,PJYjYb7oKtSwpE613W44bg,32,1,2.5,Las Vegas,"Fast Food, Restaurants, Burgers"
2616,Round Table Pizza,U7xPpLet56Zhi5GDZNlmoA,42,1,3.5,Las Vegas,"Restaurants, Pizza, Buffets"
2617,Bronze Cafe at The Market,EiEaPRsi2AW3j3xraIssrA,28,1,4.5,Las Vegas,"Restaurants, Sandwiches, Grocery, Food, Juice Bars & Smoothies, Salad, Vegan"
2618,The Perch,eYJcI9cI6-kJ2NQpYdHcLw,379,1,4.0,Las Vegas,"American (New), Bars, Lounges, Restaurants, American (Traditional), Nightlife, Burgers"
2619,Subway,wFU96ah70juScw822O4Zpw,8,1,2.5,Las Vegas,"Restaurants, Fast Food, Sandwiches"
2620,Mingo Kitchen & Lounge,zjvnqTjBp56NhMp1GrlO5g,169,1,4.0,Las Vegas,"Nightlife, Lounges, Bars, Restaurants, Mexican, Comfort Food, Asian Fusion"
2621,Vic & Anthonys Steakhouse,bjSC_jbrypke0l-bXXBmwQ,514,1,4.5,Las Vegas,"American (Traditional), Restaurants, Steakhouses, Seafood, American (New)"
2622,Sushi Hagi,Dcu698L9WArPRc9mAYrAzA,70,1,4.5,Las Vegas,"Restaurants, Sushi Bars"
2624,Peru Chicken,K7ESHh6Uh5NptgI5bfsShQ,37,1,4.5,Las Vegas,"Restaurants, Peruvian"
2625,A Wedding Chapel In Las Vegas,xv-A7RZuC5Qlxu9CEzuyig,20,1,2.0,Las Vegas,"Pizza, Event Planning & Services, Restaurants, Wedding Chapels"
2626,Prosecco Fresh Italian Kitchen,XiN6fI8I3Mzg2nPRJ9ukRQ,96,1,4.5,Las Vegas,"Bars, Wine Bars, Nightlife, Italian, Restaurants, Pizza"
2627,El Herradero Mexican Grill,QcyCiiyGZjVbx0X2_Dc4Cw,6,1,3.5,Las Vegas,"Mexican, Restaurants"
2628,Viva Salsa,-iBk1_3M_efQtY6Bcygp5w,8,1,4.5,Las Vegas,"Mexican, Restaurants"
2629,Casa Don Juan  - Downtown,a192hdM0_UVCYLwPJv1Qwg,654,1,4.0,Las Vegas,"Seafood, Restaurants, Mexican"
2634,China Roll,IcnJlauqhHfelo_qp9uKuw,30,1,3.5,Las Vegas,"Restaurants, Chinese"
2635,Bah\xc3\xada Centroamerica Restaurant,Kbidfh24_7-a380tovQeYA,16,1,4.0,Las Vegas,"Restaurants, Mexican"
2637,Grand Caf\xc3\xa9,X6DR-xr0rQKnxl9jeZWFzw,68,1,3.0,Las Vegas,"Restaurants, American (New), Cafes"
2638,Ocean One Bar and Grille,Trbt0Ex85yvwT8DHoEFCvg,480,1,3.0,Las Vegas,"Restaurants, American (New), Bars, Nightlife"
2639,DJs Taco Bar,QF2P3oJqCJC9z0TPDDFVxw,309,1,4.0,Las Vegas,"Tex-Mex, Ethnic Food, Specialty Food, Food, Restaurants, Mexican, Tacos"
2640,Japonais,azIZRqX_1qbp0_6GKSgSAA,339,1,3.5,Las Vegas,"Japanese, Sushi Bars, Restaurants, Asian Fusion"
2641,Lazy Dog Restaurant & Bar,0_aeYE2-VbsZts_UpILgDw,669,1,4.0,Las Vegas,"Food, Beer, Wine & Spirits, Restaurants, Pizza, American (New)"
2642,Maggianos Little Italy,wXRhRfnXaV_icpT5P8r9pg,71,1,3.5,Las Vegas,"Food, Cocktail Bars, Desserts, Nightlife, Bars, Italian, Restaurants"
2644,Hooters Palms,TQFeyV5Ll449uQd3JprHcg,93,1,3.0,Las Vegas,"Chicken Wings, Food, Restaurants, Beer, Wine & Spirits"
2646,Thai Pepper,E7VRsyNQWPteH6_qI4j7bw,278,1,3.5,Las Vegas,"Thai, Asian Fusion, Vegetarian, Restaurants"
2647,Black Bear Diner,PQER4ba8Q0zqB1G2QiXamQ,829,1,4.0,Las Vegas,"Restaurants, Diners, Breakfast & Brunch, American (Traditional)"
2648,Popeyes,86xm0Q8iX5ZjODWMkvwnxA,6,1,3.5,Las Vegas,"Restaurants, Chicken Shop, Fast Food, Southern, Chicken Wings"
2649,Excalibur Pool,t7YEHbN6NiuS1oBlD-R6ag,45,1,3.0,Las Vegas,"Cafes, Restaurants, Swimming Pools, Active Life"
2650,Palio Pronto,Zv3VAfR8-9-M-etTuGZU_Q,19,1,3.5,Las Vegas,"Cafes, Bakeries, Restaurants, Sandwiches, Food"
2651,Gardunos,4tWF2w6jP2LNK2xTVNEMFw,45,1,3.0,North Las Vegas,"Restaurants, Mexican"
2653,Make It Yourself Pizza,DYNeABXl0-ZviedEXX-gUw,4,1,5.0,Las Vegas,"Gluten-Free, Pizza, Restaurants"
2654,Mr Mamas,mDR12Hafvr84ctpsV6YLag,1248,1,4.5,Las Vegas,"Burgers, Breakfast & Brunch, Sandwiches, Restaurants, American (Traditional)"
2655,Tacos El Jefes,lOmt6Edj6A4OZBUIUwtI8Q,25,1,4.0,Las Vegas,"Food, Restaurants, Latin American, Mexican"
2656,Three Angry Wives,LJt-NO2FhvQxTmBoaaLhTg,177,1,3.0,Las Vegas,"Restaurants, Pubs, Nightlife, Bars, Sandwiches, Irish"
2657,Iron Skillet,3-IoSBy9vRKP2MWZwlf6wA,38,1,3.0,North Las Vegas,"Restaurants, American (Traditional), Breakfast & Brunch, Diners"
2659,McDonalds,CHW_DPKnTqudyRaDa4vwkg,46,1,2.0,Las Vegas,"Burgers, Restaurants, Fast Food"
2660,Landrys Seafood,vzrcPqSdRY41GoO5DR5pYA,211,1,3.0,Las Vegas,"Restaurants, Seafood, American (Traditional)"
2662,Del Taco,mKNzA_CjO3NXcCn9RphHiw,7,1,3.5,Las Vegas,"Mexican, Restaurants"
2664,Sushi Fever,GkRF8rSvh9cOQuuPeDh9bg,299,1,4.0,Las Vegas,"Sushi Bars, Restaurants, Japanese"
2666,Jack in the Box,ff6B-NAhNYnDFpaKziDBJg,17,1,2.5,Las Vegas,"Restaurants, Fast Food"
2667,Jimmy Johns,cjlYcqxyqRBe_w3OgasPAw,54,1,3.5,Las Vegas,"Sandwiches, Restaurants"
2668,Five Star Tavern,cHAhW7XJ2no_qzc46HpohQ,4,1,4.0,Las Vegas,"Bars, Arts & Entertainment, Casinos, Restaurants, Italian, Nightlife, American (Traditional)"
2669,Capriottis Sandwich Shop,pYu6GDIfdK1RfwgUKeeDYg,46,1,3.0,Las Vegas,"Restaurants, Sandwiches"
2671,Old Homestead Steakhouse,gdWy-x5KbCbMrwIwI87mMg,337,1,4.0,Las Vegas,"Restaurants, Steakhouses"
2672,Sinatra,e0JOkQYz_cnz91k6X55PLw,422,1,4.0,Las Vegas,"Italian, Restaurants"
2673,Hugos Cellar,VG0nWxGsPixYLsyi49gyxQ,647,1,4.5,Las Vegas,"Restaurants, Seafood, Steakhouses, American (New), American (Traditional)"
2674,Peace Ethiopian Market & Cafe,nkEhPZENx6jJzkmYherGYg,7,1,4.5,Las Vegas,"Ethnic Food, Specialty Food, Breakfast & Brunch, Ethiopian, Restaurants, Cafes, Food, Imported Food"
2676,PublicUs,0EgYXYjt2XJL4hlsKnzrcw,441,1,4.5,Las Vegas,"Cafes, American (New), Restaurants, Food, Coffee & Tea"
2677,Tower Pizzeria,0IjBFHFm8M-VPyym-Xrkhw,21,1,3.5,Las Vegas,"Pizza, Restaurants"
2679,Einstein Bros,jlpseJr1CS8aCMieENkQ8g,71,1,3.0,Las Vegas,"Breakfast & Brunch, Restaurants, Delis, Food, Bagels"
2680,1923 Bourbon & Burlesque,TN89zi12H1TXgFoELFCE4w,70,1,3.5,Las Vegas,"Restaurants, Venues & Event Spaces, Arts & Entertainment, Nightlife, American (Traditional), Event Planning & Services, Music Venues, Cocktail Bars, Bars"
2681,East Side Pizza,8lZtLSeJVg28Gb75iklmmQ,111,1,3.5,Las Vegas,"Pizza, Italian, Sandwiches, Caterers, Restaurants, Event Planning & Services"
2682,Jack In the Box,7_F6dA9xh2lydTtr1LCtIQ,30,1,3.0,Las Vegas,"Burgers, Restaurants, Fast Food"
2684,Courtyard Grill & Buffet,wsdxhfW0aVf7ayMqId1HmA,4,1,2.5,Las Vegas,"American (New), Restaurants"
2685,Sura BBQ Buffet,FQB3VXrWYM_m_XrzwRozAg,544,1,3.5,Las Vegas,"Buffets, Restaurants, Korean, Barbeque"
2686,Andres Bistro & Bar,jaSowNITPRRCYpPb3_pjdA,12,1,5.0,Las Vegas,"American (New), Nightlife, French, Food, Bars, Restaurants, Desserts"
2687,Subway,6r8YOdxoNYfkEfqxl-nO1A,16,1,2.0,Las Vegas,"Fast Food, Restaurants, Sandwiches"
2689,Subway,Q283sagGad1VlOncWykBKQ,6,1,1.5,Las Vegas,"Restaurants, Fast Food, Food, Sandwiches"
2690,Hot Head Burritos,UUfioP3G4Qowm0x2HQlPtA,93,1,3.5,Las Vegas,"Restaurants, Mexican, Fast Food"
2691,Tacos El Burrito Loco,dYZqJ2S1ND9KghLIKJg71g,18,1,3.5,Las Vegas,"Restaurants, Mexican"
2693,Soul Food Cafe,WVvqV0cmNR3j7ChPoI74hQ,315,1,3.5,Las Vegas,"Soul Food, Barbeque, Southern, Restaurants"
2694,Diablos Cantina,0AQnRQw34IQW9-1gJkYnMA,996,1,3.0,Las Vegas,"Mexican, Restaurants, Bars, Nightlife"
2696,Oodolee Sushi & Grill,EHIUp6lUabQCtQ4SVZitQw,224,1,4.0,Las Vegas,"Seafood, Restaurants, Japanese, Sushi Bars"
2697,Yannis Gyros,5VeKrLlQdJjMmKGwBBvMmw,147,1,4.0,Las Vegas,"Restaurants, Greek"
2699,Kopper Keg Restaurant & Lounge,jGZRh1xFsy14fec3IG6-Hg,18,1,4.0,Las Vegas,"American (Traditional), Restaurants"
2700,Charleston Pizza,QxtvTC-i4kX1raUXCuaxbg,3,1,3.5,Las Vegas,"Pizza, Restaurants"
2701,Lindbergh Cafe,F2AGM6YIOJ3oM9jvTmStqA,13,1,3.5,Las Vegas,"Food, Restaurants, Desserts, American (New), Coffee & Tea"
2702,Superbook Deli,dupc1Q5bl1gwTheS1ZqEig,38,1,3.0,Las Vegas,"Sandwiches, Restaurants, Delis, American (New)"
2703,P.F. Changs,T3ASfec34b8-uYr3xZj8Lw,261,1,3.5,Las Vegas,"Gluten-Free, Asian Fusion, Chinese, Restaurants"
2704,Squeeze In,XvOzizKafffkMuk-tIdNcQ,34,1,3.5,Las Vegas,"Restaurants, Breakfast & Brunch"
2705,Swish Shabu Shabu,_8VkSb_Mryb6bHQxSWB7Pg,366,1,4.0,Las Vegas,"Japanese, Hot Pot, Fondue, Restaurants, Sushi Bars"
2706,Churchs Chicken,Wyc49dq1r5uMqBl9bHVPAw,17,1,2.5,Las Vegas,"Chicken Wings, Restaurants"
2707,Robertos Taco Shop,mibbKeg4gbD9O58TCjDWgQ,44,1,2.5,Las Vegas,"Fast Food, Mexican, Restaurants"
2708,Yoshi Burritos,_RiwESa2w64ls6y_5tE4CA,46,1,4.5,Las Vegas,"Food, Sushi Bars, Asian Fusion, Poke, Restaurants"
2709,Bouchon at the Venezia Tower,rcaPajgKOJC2vo_l3xa42A,3292,1,4.0,Las Vegas,"Bakeries, Restaurants, French, Food, Event Planning & Services, Venues & Event Spaces, Breakfast & Brunch, Cafes"
2710,The Buffet,2weQS-RnoOBhb1KsHKyoSQ,3676,1,3.5,Las Vegas,"Buffets, Restaurants"
2711,Thai Room,QDF7w0casJ78PcPmtMDISw,130,1,4.0,Las Vegas,"Thai, Restaurants"
2712,Lifes A Bagel,IFvBnwcWJ54BgMzVnCxIrQ,32,1,4.5,Las Vegas,"American (Traditional), Delis, Food, Restaurants, Sandwiches, Bagels"
2714,A18 Baraoke,SLx-vB9LnRtC83oAeVdAuA,75,1,5.0,Las Vegas,"Karaoke, Bars, Nightlife, Korean, Restaurants, Asian Fusion"
2716,Pan Asian Express,xqoBJepL-cB-M_6Di1Sdjw,13,1,1.0,Las Vegas,"Restaurants, Pan Asian, Chinese"
2717,Lucky Chengs Restaurant,bYw7mT1e3frkxG0nd2_mjg,11,1,3.5,Las Vegas,"Nightlife, Restaurants, Adult Entertainment, Arts & Entertainment, Performing Arts, Asian Fusion"
2719,Perk Up Coffee Shop,x71EvWJDVKZfM-OiYDWZ6A,112,1,4.0,Las Vegas,"Breakfast & Brunch, Coffee & Tea, Restaurants, Food"
2721,Cafe Hookah,axJFWAeEJ-kRs8LFy8ow1A,3,1,3.5,Las Vegas,"Restaurants, Mediterranean, Nightlife, Bars"
2722,Timbers - Lake Mead,AkG4ozbKUgjDk8-Mmywsxw,56,1,3.0,Las Vegas,"Breakfast & Brunch, American (Traditional), Food, Restaurants, Nightlife, Beer, Wine & Spirits, Bars"
2723,OAces Bar & Grill,rTN9PfZFa3vmfyPZd-u9sw,17,1,4.0,Las Vegas,"American (Traditional), Sports Bars, Bars, Nightlife, Restaurants"
2724,Jean Philippe Patisserie,UUGoM4q4i8rK2CBRS0xDAw,1046,1,4.0,Las Vegas,"Cafes, Food, Desserts, Restaurants, Coffee & Tea"
2725,Chicken Connection,3c6U5CdxsN_6Gpc6dqTylg,21,1,3.0,Las Vegas,"Restaurants, Chicken Wings, Fast Food"
2726,Waffle Bar,xDj6VQrMtbKrz8NSkJv_XA,48,1,4.0,Las Vegas,"Waffles, Food, Desserts, Restaurants, Breakfast & Brunch"
2727,barMASA,ni4ppUp4oHq-OSSCgUIGiA,244,1,2.5,Las Vegas,"Japanese, Sushi Bars, Restaurants"
2731,Ketchup Premium Burger Bar,WEeMwRLhgCyO1b4kikVcuQ,210,1,3.0,Las Vegas,"Burgers, Restaurants"
2733,SW Steakhouse,L_ZLtfHvfzfoNVQ0-okTXg,883,1,4.0,Las Vegas,"Steakhouses, Restaurants"
2735,Pizza Hut,tb4uP6nnel0veA_hvFmr6Q,12,1,1.0,North Las Vegas,"Pizza, Restaurants"
2736,Prommares Thai Food,kosTPb88O4Q0XGbVbEOGCA,175,1,4.0,Las Vegas,"Restaurants, Thai"
2737,Viva El Taco,1kHr1RTkm_J-dfrq-HPBug,23,1,3.5,Las Vegas,"Restaurants, Mexican"
2738,Applebees,m97jaBYRscg-hqDjMVIIWg,88,1,3.0,North Las Vegas,"Sports Bars, Burgers, Bars, Nightlife, American (Traditional), Salad, Restaurants"
2739,Arandas Taqueria,7NvIgf7XW55OKa5ZU7gw8Q,20,1,4.0,Las Vegas,"Restaurants, Mexican"
2740,McDonalds,q7LG_2s2urLJcD2IsxgTWg,8,1,3.0,Las Vegas,"Burgers, Restaurants, Fast Food"
2741,Good Fella Korean Bistro,Lzg7YuoP1SDyg2S5lvBvhg,93,1,4.5,Las Vegas,"Nightlife, Restaurants, Korean, Bars, Asian Fusion"
2742,China Joes,9SHoWGXsGOCa5hOjBOzPtg,34,1,2.0,Las Vegas,"Restaurants, Chinese"
2743,Maestros Pizzeria,h3BoyKFgStjnBeKO-wLmIg,74,1,3.5,Las Vegas,"Restaurants, Pizza"
2744,Aloha Kitchen,TeggG3duunpoy__1Y2SAyQ,302,1,3.5,Las Vegas,"Hawaiian, Restaurants"
2745,Carefree Catering,5QsW4RdCrDhVuDHnlgnCuA,10,1,3.5,Las Vegas,"Food, Food Trucks, Food Stands, Restaurants, Street Vendors"
2746,Jack in the Box,OSxC4A2g8fVn2XCH18FmAg,12,1,3.0,North Las Vegas,"Restaurants, Fast Food"
2747,Zabas Mexican Grill,34PMhyoSQHVd4Lr7slzUcA,54,1,3.0,Las Vegas,"Mexican, Restaurants"
2748,Circus Buffet,lZZLmG1ANLq2Yb3KuVA4NA,281,1,2.0,Las Vegas,"American (New), Arts & Entertainment, Casinos, Restaurants, Buffets"
2749,Pizza Joint,WqjHEdAftag4ixm09POepQ,40,1,3.0,Las Vegas,"Restaurants, Pizza"
2750,Wendys,dMEo-GjWAmTVzq3_qeQX2g,11,1,2.5,Las Vegas,"Fast Food, Restaurants, Burgers"
2751,SUSHISAMBA - Las Vegas,pH0BLkL4cbxKzu471VZnuA,1823,1,4.0,Las Vegas,"Dim Sum, Chinese, Breakfast & Brunch, Nightlife, Asian Fusion, Restaurants, Bars"
2752,Tableau,Yp9w4nhUowBU_IS_StFXbQ,358,1,4.0,Las Vegas,"Restaurants, Mexican, French, American (New)"
2754,Del Taco,FgPANtTwZqXB-edLkZTXQg,29,1,3.5,Las Vegas,"Mexican, Restaurants, Fast Food"
2755,Lauritas Taco Shop,Fkj8vJocYilePMZv2y54WA,94,1,3.5,Las Vegas,"Restaurants, Mexican, Breakfast & Brunch"
2756,Sushi Hiroyoshi Japanese Cuisine,vOMDU31gdylrzBhAKC9QbA,104,1,5.0,Las Vegas,"Japanese, Restaurants, Sushi Bars"
2757,Chipotle Mexican Grill,NHFsXnwZDkY3ufoTE9iKjQ,32,1,3.5,Las Vegas,"Fast Food, Mexican, Restaurants"
2758,Gordon Ramsay Fish & Chips,CVKOPzBVOj3_apFUmZ9ZWw,191,1,4.0,Las Vegas,"Restaurants, Seafood, Fish & Chips, Comfort Food"
2759,Nacho Daddy,QXV3L_QFGj8r6nWX2kS2hA,347,1,4.5,Las Vegas,"Restaurants, American (New), Breakfast & Brunch, American (Traditional), Tex-Mex, New Mexican Cuisine, Vegan, Mexican"
2760,Johnny Rockets,CxE5OE_t29h_wqqK1BsoFA,26,1,2.0,Las Vegas,"Restaurants, Burgers, American (Traditional), Diners, Sandwiches"
2763,Blizz,-hzQQ8tbXThpp0k5E_y1Dw,56,1,3.0,Las Vegas,"Desserts, Ice Cream & Frozen Yogurt, Food, Restaurants"
2765,Picasso,0q_BHpxbikVtPRRLRu-U0g,711,1,4.5,Las Vegas,"Bars, French, Restaurants, Spanish, Nightlife"
2766,STK Las Vegas,bpRo8L8dkhgbJhdIKa9mwA,1158,1,4.0,Las Vegas,"Bars, Cocktail Bars, Restaurants, American (New), Steakhouses, Nightlife"
2767,Le Cirque,rtlsfmdufArhk-47sWIf2w,548,1,4.5,Las Vegas,"French, Restaurants"
2769,Brooklyn Bowl,BslEhCyzaQPfpHtDogb4hQ,445,1,3.5,Las Vegas,"Arts & Entertainment, Bowling, Nightlife, Music Venues, Active Life, American (New), Restaurants"
2770,Cafe Vetro,5i-SK1EztIn6YnhcRvatTQ,12,1,3.0,Las Vegas,"Restaurants, American (New)"
2771,LuckyRice Night Market,PYIk6aWfw8B8bO1mTn2rpQ,8,1,4.0,Las Vegas,"Food, Asian Fusion, Restaurants, Imported Food, Specialty Food, Ethnic Food"
2773,La Creperie,6fPQJq4f_yiq1NHn0fd11Q,427,1,3.5,Las Vegas,"Restaurants, Creperies, French"
2774,China Poblano,GJ_bXUPv672YwNg4TneJog,1219,1,3.0,Las Vegas,"Asian Fusion, Mexican, Restaurants, Chinese"
2775,Envious Extensions,0EH_sUvRkgpa4cjHm3hQNQ,6,1,4.0,Las Vegas,"Wigs, Health & Medical, Hair Stylists, Skin Care, Shopping, Restaurants, Beauty & Spas, Blow Dry/Out Services, Hair Removal, Hair Extensions, Hair Salons, Cosmetics & Beauty Supply, Pizza, Waxing"
2777,Sweet Pok\xc3\xa9,9UVkAmyodpaSBm49DBKFNw,227,1,4.5,Las Vegas,"Japanese, Food, Poke, Seafood, Asian Fusion, Restaurants, Hawaiian, Sushi Bars"
2778,Papa Johns Pizza,AES2bv2pf2jIL5c2qVQ33w,76,1,2.0,Las Vegas,"Restaurants, Pizza"
2779,Dennys,VOAO6ip7GwK4McQZbRa60g,70,1,3.0,Las Vegas,"Breakfast & Brunch, Restaurants, Diners, American (Traditional)"
2781,Divine Cafe at the Springs Preserve,W1Yr6c2XDx_RBjb6WsV-aQ,115,1,4.0,Las Vegas,"American (New), Restaurants, Bars, Wine Bars, Cafes, Nightlife"
2782,Grimaldis Pizzeria,3nf-a84p8LC41_WAIvJPjg,228,1,4.0,Las Vegas,"Pizza, Restaurants"
2783,Lobster Me,ggqmML5wN5RFv5QtHQw4iA,23,1,3.5,Las Vegas,"Restaurants, Seafood"
2784,HoneyBaked Ham,kpjH-yKe3zsgbO7YMQ65_g,22,1,4.0,Las Vegas,"Meat Shops, Restaurants, Specialty Food, Cafes, Event Planning & Services, Food, Delis, Sandwiches, Caterers"
2785,The Cheesecake Factory,-Ylpy3VyRWwubf9dysuwjQ,496,1,4.0,Las Vegas,"Food, American (New), Desserts, American (Traditional), Restaurants"
2788,QDOBA Mexican Eats,sueADCkf8a4m3Exnd-4qeQ,55,1,3.5,Las Vegas,"Restaurants, Mexican, Fast Food, Event Planning & Services, Caterers"
2789,Buffet Asia,VKmGedwOk-16D7OawNg_ng,282,1,3.0,Las Vegas,"Korean, Japanese, Chinese, Buffets, Sushi Bars, Restaurants, Dim Sum"
2790,Sea Harbour,pzBTsxScWslK5VpfK-qWjw,11,1,2.5,Las Vegas,"Restaurants, Asian Fusion, Seafood"
2792,Subway,8menaxER6kxM_Lyi5tBmSA,3,1,1.5,Las Vegas,"Restaurants, Sandwiches"
2793,Se\xc3\xb1or Frogs,HWl2EbZhkhAkFgqt44yUkA,575,1,2.5,Las Vegas,"Restaurants, Bars, Mexican, Nightlife, Cocktail Bars"
2795,Teru Sushi,Tu3pgH2X_ml6rsD9dsr_vQ,19,1,3.0,Las Vegas,"Japanese, Sushi Bars, Restaurants"
2797,Mr. Z Tea Co,BjRi5W4tESsLRwVb85GIMQ,53,1,4.5,Las Vegas,"Coffee & Tea, Tea Rooms, Food, Juice Bars & Smoothies, Taiwanese, Restaurants"
2798,Antojos la G\xc3\xbcera Mexican Grill,NYRkbIL7yL7o75-MjhbgWw,6,1,4.5,Las Vegas,"Mexican, Restaurants"
2800,L & L Hawaiian Barbecue,iVBpGb7x55toxxL81PB2wA,22,1,4.5,Las Vegas,"Barbeque, Event Planning & Services, Restaurants, Caterers, Hawaiian"
2801,Vegas Buffet,hx-oJMNnweYqE5ybU8aiSg,67,1,2.5,Las Vegas,"Seafood, Restaurants, Asian Fusion, Buffets, Chinese"
2803,Crush,gc_GGat7TgNCmrgc4nVOgw,185,1,3.5,Las Vegas,"Nightlife, Tapas Bars, Bars, Lounges, Restaurants"
2804,Beach Caf\xc3\xa9,KRaxPApQv43oX6Dcv3jKQA,198,1,3.0,Las Vegas,"American (Traditional), Restaurants"
2805,Subway,M7ZuMAutAtvplANHiOz_ug,3,1,1.0,Las Vegas,"Sandwiches, Fast Food, Restaurants"
2806,Lago,SeNOJ2zYHziptxLuiRINLg,457,1,4.0,Las Vegas,"Italian, Tapas/Small Plates, Restaurants"
2807,Kobe Sushi Bistro,WrHu03srbhJAw6bnTIixdw,400,1,3.5,Las Vegas,"Sushi Bars, Japanese, Restaurants"
2809,Bens BBQ & Smokehouse,5MnLa1nE606cvNGlSFt01Q,21,1,3.5,Las Vegas,"Barbeque, Food, Food Trucks, Restaurants"
2810,Wolfgang Puck Bar & Grill,N0apJkxIem2E8irTBRKnHw,1282,1,4.0,Las Vegas,"Nightlife, American (New), Bars, Restaurants"
2811,El Segundo Sol,Rj-7ymdw8aNZBRqGRAjR3Q,531,1,4.0,Las Vegas,"Mexican, Restaurants, Bars, Venues & Event Spaces, Nightlife, Cocktail Bars, Event Planning & Services"
2813,Pho Bistro,0VjHFdczi6Nln_nn8bucJQ,91,1,4.0,Las Vegas,"Restaurants, Chinese, Vietnamese"
2814,Paymons Mediterranean Cafe & Lounge,f4kNNLU_0q_2J711jCN7dA,477,1,4.0,Las Vegas,"Greek, Restaurants, Vegetarian, Mediterranean"
2815,Chile Verde Express Mexican Grill,oN_A87dyVD2FBk7coLnhCg,149,1,4.5,Las Vegas,"Restaurants, Mexican"
2817,Los Lupes Mexican Restaurant,8USUyIeN39rurnqCn5cA0w,58,1,4.5,Las Vegas,"Restaurants, Mexican"
2818,Samurai Sams,JdXWoFcLDxE7OhC63r8zAQ,31,1,2.5,Las Vegas,"Restaurants, Japanese"
2819,The Cheesecake Factory,NoA6bD6W7z_Aztk_cOU5cg,148,1,3.0,Las Vegas,"American (Traditional), Food, Restaurants, Desserts, Breakfast & Brunch"
2821,Jersey Mikes Subs,r-jaMF7dyyaiOXlcmQJRdQ,29,1,4.0,Las Vegas,"Fast Food, Delis, Restaurants, Sandwiches"
2822,JCs Irish Sports Pu,jhjmgnCYsTpIe-XOMZR-vA,79,1,3.0,Las Vegas,"Restaurants, Pubs, Bars, Sports Bars, Nightlife, Irish"
2823,Prime,SZEFE5hL7aN5nM-A44iPwQ,632,1,4.0,Las Vegas,"Restaurants, Nightlife, Bars, Steakhouses"
2824,Rush Hour Tavern,qov0ZyFFLCIKM-9ewBqPjw,10,1,4.0,Las Vegas,"Bars, American (Traditional), Restaurants, Nightlife"
2825,Olives,QJR4qBUHegWEozSQrGmBPw,1543,1,4.0,Las Vegas,"Bars, American (New), Restaurants, Nightlife, Mediterranean"
2830,Chicke Now,0UESjBq6_kPjCs4zPh4oEQ,9,1,3.5,Las Vegas,"Chicken Shop, Restaurants, American (New)"
2832,Buffet of Buffets,pJpjgXH5lgJtIJos9GqetQ,368,1,4.0,Las Vegas,"Buffets, Restaurants"
2833,McDonalds,ajwGl90CuCZac3BKWY1ShQ,20,1,2.0,Las Vegas,"Fast Food, Burgers, Restaurants"
2834,In-N-Out Burger,Yq92uUpugGyJLvDtcDRunw,181,1,4.5,Las Vegas,"Restaurants, Fast Food, Burgers"
2835,Tilted Kilt Pub & Eatery,5_MrPFw9E0cMJ1Q0DJFZOQ,231,1,3.0,Las Vegas,"Sports Bars, Nightlife, American (Traditional), Restaurants, Pubs, Bars"
2836,Olive Garden Italian Restaurant,viji5rHhNlsy9w-JmUhyaw,113,1,3.5,Las Vegas,"Nightlife, Bars, Restaurants, Italian, Salad, Wine Bars"
2837,La Bonita Supermercado,woJ0p5-_bc1BCezm16qtZQ,20,1,3.5,Las Vegas,"Restaurants, Mexican, Food, Grocery"
2838,Tasty Grill,u4IDWradF0DQSdfiUNpS2Q,23,1,4.5,Las Vegas,"Pizza, Burgers, Restaurants, American (Traditional), Chicken Wings"
2839,NYP- Pizzeria,hdZ_4Vd9opGm5UajNUuhwA,96,1,3.5,Las Vegas,"Restaurants, Italian, Pizza"
2840,Casanova,Gyrez6K8f1AyR7dzW9fvAw,362,1,4.0,Las Vegas,"Mediterranean, Restaurants, Italian"
2841,Noodle Asia,_j2EtQtgLuXGRBfbM5YwZA,851,1,3.5,Las Vegas,"Restaurants, Chinese, Noodles"
2842,Zoozacrackers Deli,a3APDveO8DSEIp7o1f24hw,269,1,3.5,Las Vegas,"Delis, Restaurants, Sandwiches, Burgers"
2843,Eiffel Tower Restaurant,xVEtGucSRLk5pxxN0t4i6g,1314,1,4.0,Las Vegas,"Steakhouses, French, Bars, Cocktail Bars, Restaurants, Nightlife"
2844,SEA: The Thai Experience,jVD09YgKsDtKD5sOYes6wg,311,1,3.5,Las Vegas,"Thai, Vietnamese, Asian Fusion, Restaurants"
2845,Palio,gS0CcaNcmiU18nLqqELhUQ,85,1,4.0,Las Vegas,"Breakfast & Brunch, Nightlife, Coffee & Tea, Desserts, Food, Coffeeshops, Restaurants"
2846,Jimmys Seaside Fries,jfUarAupxK2BwoYj8hjQVw,5,1,3.5,Las Vegas,"Street Vendors, American (Traditional), Food, Restaurants, Fast Food"
2847,Mesa Grill,XZbuPXdyA0ZtTu3AzqtQhg,2771,1,4.0,Las Vegas,"Tex-Mex, Southern, Restaurants, Mexican, American (New)"
2848,Hyde Bellagio,K7fip0nDFFdCC7OCnNOotQ,456,1,3.5,Las Vegas,"Bars, Nightlife, Lounges, Restaurants, Wine Bars, Italian"
2849,Katsuya,RSOinkOUpxm0mGw1IWr4Xw,287,1,4.5,Las Vegas,"Restaurants, Japanese, Sushi Bars"
2850,Daddys Delights,kc5JPu8lkg64yUbrheJxng,112,1,3.0,Las Vegas,"Restaurants, Pizza, Vegetarian"
2851,Nosh,Nv8p5Hpf3dfAPx14yoRaBA,81,1,3.0,Las Vegas,"Bakeries, Food, Restaurants, Bagels, Sandwiches"
2854,Pizza Hut,QSM3w1AAdFDQXGE26vNsZA,35,1,2.0,Las Vegas,"Chicken Wings, Restaurants, Pizza"
2855,Golden Cake,kqO-dgJ_Ww17qVJXsPTfnw,4,1,2.0,Las Vegas,"Restaurants, Food, Bakeries"
2856,Da Pizzeria,hmRR9whRtnbV5LyIC3Bxrg,3,1,3.5,Las Vegas,"Restaurants, Pizza"
2857,Sports Book Grill,wJAs37fHi3iqQ8Huym1mGg,20,1,3.5,Las Vegas,"Restaurants, Sandwiches, Pub Food, Fast Food"
2859,Subway,OSLEi9yMmaV0FBZKshJnUw,6,1,3.5,Las Vegas,"Restaurants, Sandwiches, Fast Food"
2861,Del Taco,ySBvgchqN-sJmvUQVcTpnw,18,1,3.0,Las Vegas,"Mexican, Restaurants"
2864,Little Hong Kong,vX-FwyJ7eINXn_Gn6CqMFg,25,1,3.0,Las Vegas,"Filipino, Restaurants, Chinese"
2866,Cafe Gelato,huOCKRwDvNqGX3KSzYawbw,173,1,4.0,Las Vegas,"Coffeeshops, Nightlife, Cafes, Gelato, Ice Cream & Frozen Yogurt, Food, Coffee & Tea, Desserts, Restaurants"
2867,Virgils Real Barbecue,zaxK3ea92mvEBRy-jttngg,19,1,4.0,Las Vegas,"Restaurants, Arts & Entertainment, Bars, Barbeque, Nightlife, Music Venues, Chicken Wings, American (Traditional)"
2868,Hakkasan Restaurant,kICgNgVRkIh4doz0atyMMA,308,1,4.0,Las Vegas,"Dim Sum, Dance Clubs, Lounges, Bars, Chinese, American (Traditional), Cantonese, American (New), Restaurants, Nightlife"
2871,Luna Lounge,UN_6ebslv5cxdDmZAX3ivQ,278,1,4.0,Las Vegas,"Restaurants, Hookah Bars, Lounges, Nightlife, Tapas Bars, Bars"
2873,Le Pho Vietnamese Kitchen,r05kbKriZ3Z56Nre1WQIDg,136,1,4.0,Las Vegas,"Restaurants, Food, Vietnamese, Asian Fusion, Bars, Nightlife"
2874,Bentto Rock 1,jsOGd-P1BfoUY40yY5l59A,20,1,3.5,Las Vegas,"Restaurants, Japanese"
2875,Chao Thai Restaurant,QmVF3KJ07PsdroCFwOC_Ow,152,1,4.0,Las Vegas,"Thai, Food, Food Delivery Services, Restaurants"
2876,Sushi Roku,gBfPyzPRmeOaj3SdcIj0Rw,950,1,4.0,Las Vegas,"Lounges, Sushi Bars, Nightlife, Japanese, Bars, Restaurants"
2877,Pinot Brasserie Bakery,NieVNg1pP-PPeGUsdpy9BA,3,1,4.0,Las Vegas,"Restaurants, Coffee & Tea, Food, French"
2878,Dottys #7,9WeJvvyT-j3btKwvTXyzjw,8,1,2.0,Las Vegas,Restaurants
2879,Morels French Steakhouse & Bistro,O_C-2kZMHGnq3ZDL_OaG6Q,539,1,3.5,Las Vegas,"Steakhouses, Lounges, Bars, Nightlife, French, Restaurants"
2881,Port of Subs,gZFjmwpGXJK5YGnS3bjflg,28,1,3.0,Las Vegas,"Restaurants, Sandwiches, Delis"
2882,SNS Diner,APRp233sygej2YesZtrgbQ,151,1,4.5,North Las Vegas,"Barbeque, Restaurants, Diners"
2883,Yong Kang Street,D8yYMxz0p6oQnOQnLRUIyA,284,1,3.0,Las Vegas,"Restaurants, Taiwanese, Chinese, Cantonese, Dim Sum, Japanese, Ramen"
2884,Johnny Rockets,FWBWBnM2zjycBI7QrayklA,4,1,2.0,Las Vegas,"Restaurants, Burgers, Fast Food, American (Traditional), Diners"
2885,Delmonico Steakhouse,--9e1ONYQuAa-CB_Rrw7Tw,1311,1,4.0,Las Vegas,"Steakhouses, Restaurants, Cajun/Creole"
2886,Wendys,uaBVv3tZJaOd8lfPFInzTA,16,1,2.5,Las Vegas,"Restaurants, Fast Food, Burgers"
2888,Little Caesars Pizza,5qK5rJxwo0cjP3vTf3lkSA,18,1,1.5,Las Vegas,"Pizza, Restaurants"
2889,Paris Baguette,tFC0oaQO0wpwMIaJyUSsAQ,76,1,4.0,Las Vegas,"Coffee & Tea, Bakeries, Cafes, Food, Restaurants"
2891,Market City Caffe,ppmYIHMCIL5bocUsJSsDWA,11,1,3.5,Las Vegas,"Restaurants, Italian"
2892,Battistas Hole In the Wall,yNVcnSaMSrTmjJBMrHTy9w,813,1,3.5,Las Vegas,"Restaurants, Italian"
2894,B and B Ristorante,GTR39A2jwNIS_NV8q2r_JA,698,1,3.5,Las Vegas,"Restaurants, Italian, Seafood"
2895,LA Subs & Salads,d9YAMj9ldM4jyBNn5bIBrg,10,1,3.5,Las Vegas,"Salad, Restaurants, Sandwiches"
2896,El Patio Catering,irVqdCcmeO_Qhz8YcwaxOA,4,1,3.0,Las Vegas,"Food Stands, Mexican, Restaurants"
2898,B&B Burger & Beer,GZONBn0K1yp2aaD-l8debQ,423,1,3.0,Las Vegas,"Barbeque, Italian, Restaurants, Burgers, Cocktail Bars, Nightlife, Bars, Beer Bar"
2901,Cooks BBQ,w1gAEE4anHxNNZtJoJOTUg,4,1,2.0,Las Vegas,"Barbeque, Restaurants"
2902,Tonys Mexican Food,7phGRr7Z36IrET7zDKD3Pg,15,1,4.0,Las Vegas,"Restaurants, Mexican"
2903,Streets of New York,QnfAHUr5-HTiaA5-va3glQ,152,1,3.5,Las Vegas,"Pizza, Italian, Restaurants, Sandwiches"
2904,Piccadilly Pizza Fremont,Rt_M67qJU8x4QGhdYwnkAQ,58,1,2.5,Las Vegas,"Restaurants, Pizza"
2905,Vinos Pizzeria,OulLyhVNvZOLn-uvV-pGMA,7,1,2.5,North Las Vegas,"Restaurants, Pizza"
2906,Nikos Pizza,E_jLyf_YuGgMP_rw8tvNSA,32,1,5.0,Las Vegas,"Italian, Pizza, Restaurants, Sandwiches, Chicken Wings, Food Delivery Services, Food, Mediterranean"
2907,Capriottis Sandwich Shop,Ea3BblvC4zzagYI_1cNumA,55,1,4.0,Las Vegas,"Sandwiches, Salad, Vegetarian, Restaurants"
2908,Kabob N More,EfAqol3tWckyNrBMIooJmg,186,1,3.5,Las Vegas,"Pakistani, Restaurants, Halal, Indian, Arabian"
2909,Panda Express,V2WLiBR3iGaegRAVNjOndA,31,1,3.5,Las Vegas,"Chinese, Fast Food, Restaurants"
2910,H2 EAU,S2bGqPoTjUc2ywC9FYuBsw,11,1,3.5,Las Vegas,"Nightlife, Diners, Restaurants, Bars"
2911,Shake Shack,QJatAcxYgK1Zp9BRZMAx7g,2091,1,4.0,Las Vegas,"Burgers, Restaurants, American (New)"
